{
  "$schema": "https://json-schema.org/draft/2020-12/schema",
  "$id": "https://chassis.dev/schemas/in-toto-statement/v1",
  "version": "1.0.0",
  "title": "in-toto Statement v1 (subset for Chassis)",
  "type": "object",
  "additionalProperties": false,
  "required": ["_type", "subject", "predicateType", "predicate"],
  "properties": {
    "_type": {
      "type": "string",
      "const": "https://in-toto.io/Statement/v1"
    },
    "subject": {
      "type": "array",
      "minItems": 1,
      "items": {
        "type": "object",
        "additionalProperties": false,
        "required": ["name", "digest"],
        "properties": {
          "name": { "type": "string", "minLength": 1 },
          "digest": {
            "type": "object",
            "required": ["sha256"],
            "properties": {
              "sha256": { "type": "string", "pattern": "^[0-9a-f]{64}$" }
            },
            "additionalProperties": false
          }
        }
      }
    },
    "predicateType": {
      "type": "string",
      "const": "https://chassis.dev/attestation/release-gate/v1"
    },
    "predicate": {
      "type": "object"
    }
  }
}
